{
  "commands": [
    "quire validate --scope . 'spec/**/*.md' 'planning/**/*.md' 'plan/**/*.md'",
    "python3 scripts/validate_json_schema.py schemas/runtime-evidence-input-v1.schema.json collection-input.json",
    "python3 scripts/validate_json_schema.py schemas/runtime-evidence-manifest-v1.schema.json evidence-manifest.json",
    "python3 scripts/validate_json_schema.py schemas/pgm01-derivation-evidence-envelope-v1.schema.json evidence-envelope.json",
    "python3 scripts/validate_json_schema.py $PGM01_SCHEMA evidence-envelope.json (when available)",
    "cargo fmt --all -- --check",
    "make lint",
    "cargo test --no-default-features",
    "cargo test --features alloc",
    "cargo test --features std",
    "cargo test --all-features",
    "cargo test -p quire-contract-runtime-footprint",
    "cargo +1.75.0 check --all-targets --all-features",
    "cargo deny check licenses",
    "bash scripts/check_unsafe_comments.sh",
    "bash scripts/check_panic_surface.sh",
    "cargo metadata --format-version 1 --no-default-features",
    "cargo tree --edges normal --no-default-features",
    "cargo build --release --lib --no-default-features",
    "make size",
    "bash scripts/measure_rlib_size.sh $CARGO_TARGET_DIR/release/deps",
    "cargo run --release --example layout --no-default-features",
    "RUSTDOCFLAGS=-Dwarnings make doc",
    "cargo kani (when available)",
    "quire coverage --scope . --strict"
  ],
  "pgm01": {
    "candidateRevision": "7dac9d8c19952412b56a0347387666e2ca81e01d",
    "envelopeSchema": "quire.derivation-evidence/v1",
    "envelopeSchemaDigest": {
      "algorithm": "sha256",
      "value": "0946e235e9e4b0fa79e9b9ec27ae157b303c17de0a9408d3cc04968fb7152256"
    },
    "policy": "ix://agent-ix/quire-contract-ir/PGM-01",
    "schemaDigest": {
      "algorithm": "sha256",
      "value": "0946e235e9e4b0fa79e9b9ec27ae157b303c17de0a9408d3cc04968fb7152256"
    },
    "schemaPath": "/tmp/agent-b-ir-pgm01-7dac/schemas/derivation-evidence-envelope-v1.schema.json",
    "validatorDigest": {
      "algorithm": "sha256",
      "value": "1c2881d5f8800dab031f6afa26d5ad11f88a5ab42a942bc9fe0c2853b58df2f1"
    },
    "validatorPath": "/tmp/agent-b-ir-pgm01-7dac/scripts/validate_governance.py",
    "validatorRevision": "7dac9d8c19952412b56a0347387666e2ca81e01d"
  },
  "schemaVersion": "quire.runtime-evidence-input/v1",
  "sourceRevision": "f3f1c28d170390832436e63acefb2df5faa5ee01",
  "sourceState": "clean",
  "tools": {
    "cargo": "cargo 1.94.1 (29ea6fb6a 2026-03-24)",
    "jsonschema": "3.2.0",
    "kani": "cargo-kani 0.67.0",
    "python": "Python 3.10.12",
    "quire": "0.31.0",
    "rust-msrv": "rustc 1.75.0 (82e1608df 2023-12-21)",
    "rustc": "rustc 1.94.1 (e408947bf 2026-03-25)",
    "size": "GNU size (GNU Binutils for Ubuntu) 2.38"
  }
}
